Corpus,Corpus_URL,Size,Annotation,Licence,Language,Description,Buttons,Buttons_URL,Publication,Publication_URL,Note
Croatian Twitter training corpus ReLDI-NormTagNER-hr 2.0 ,http://hdl.handle.net/11356/1170,"89,000 tokens",word normalisation,CC BY 4.0,Croatian,"This corpus contains Tweets. The corpus is morphosyntactically tagged following the <a href=""http://nl.ijs.si/ME/V4/msd/html/index.html"">MULTEXT-East Version 4 tagset</a>.#SEPThe corpus is available through the concordancers KonText and noSketchEngine and for download from the CLARIN.SI repository.",KonText#SEPnoSketch#SEPDownload,https://www.clarin.si/kontext/first_form?corpname=reldi_hr#SEPhttps://www.clarin.si/noske/run.cgi/corp_info?corpname=reldi_hr&struct_attr_stats=1#SEPhttp://hdl.handle.net/11356/1043,Miličević and Ljubešić (2016),https://www.clarin.eu/resource-families/manually-annotated-corpora#milicevic,
Czech Legal Text Treebank 2.0,http://hdl.handle.net/11234/1-2498,1121 sentences,semantic role labelling,CC BY-NC-SA 4.0,Czech,"This corpus contains legal texts.#SEPThe corpus is available through the concordance KonText, the PML-TQ tool and for download from the LINDAT repository.",KonText#SEPPML-TQ#SEPDownload,https://lindat.mff.cuni.cz/services/kontext/first_form?corpname=legaltext_cs_a#SEPhttps://lindat.mff.cuni.cz/services/pmltq/#!/treebank/cltt20/query/#SEPhttp://hdl.handle.net/11234/1-2498,,,
Prague Discourse Treebank 2.0,http://hdl.handle.net/11234/1-1905,"49,500 sentences",mark-up of discourse phenomena enriched by the annotation of secondary connectives,CC-BY,Czech,"This corpus is a subset of the <a href=""http://hdl.handle.net/11234/1-2621"">Prague Dependency Treebank 3.5</a>.#SEPThe corpus is available through the PML-TQ tool.",PML-TQ,https://lindat.mff.cuni.cz/services/pmltq/#!/treebank/pdit20/query/,,,
Prague Czech-English Dependency Treebank 2.0 Coref,http://hdl.handle.net/11234/1-1664,"49,000 sentences",mark-up of coreference,CC-BY-NC-SA + LDC99T42 (restricted use),"Czech, English","This corpus is an extended version of <a href=""http://hdl.handle.net/11858/00-097C-0000-0015-8DAF-4"">Prague Czech-English Dependency Treebank 2.0</a>, with added mark-up of coreference. The syntactic parsing follows the <a href=""https://ufal.mff.cuni.cz/pdt2.0/"">PDT 2.0 style</a>D#SEPThe corpus is available for download from the LINDAT repository. The version without coreference annotation is available through the concordancer KonText and the PML-TQ tool.T 2.0 style.",KonText#SEPPML-TQ#SEPDownload,https://lindat.mff.cuni.cz/idpdiscovery/discovery.html?entityID=https%3A%2F%2Fufal-point.mff.cuni.cz%2Fshibboleth%2Feduid%2Fsp&return=https%3A%2F%2Flindat.mff.cuni.cz%2FShibboleth.sso%2FLogin%3FSAMLDS%3D1%26target%3Dcookie%253A1548331392_7a32#SEPhttps://lindat.mff.cuni.cz/services/pmltq/#!/treebank/pcedt20_cz/query/#SEPhttp://hdl.handle.net/11234/1-1664,,,
Artificial Treebank with Ellipsis,http://hdl.handle.net/11234/1-2616,"106,000 tokens, 10,604 sentences",mark-up of elliptical constructions,Licence Universal dependencies v2.1,"Czech, English, Finnish, Russian, Slovak","The syntactic parsing follows the <a href=""http://universaldependencies.org/guidelines.html"">Universal Dependencies</a> schema.#SEPThe corpus is available for download from the LINDAT repository.",Download,http://hdl.handle.net/11234/1-2616,,,
Grundtvig's Works Corpus ,http://hdl.handle.net/20.500.12115/31,,"linked data (places, persons, bible citations, etc.)",CC BY-NC 4.0,Danish,This corpus contains the literary works of the Danish bishop N.F.S Grundtvig.#SEPThe corpus is available for download from the CLARIN-DK repository.,Download,http://hdl.handle.net/20.500.12115/31,,,
SoNaR-1,https://ivdnt.org/downloads/taalmaterialen/tstc-sonar-corpus,1 million words,semantic role labelling,,Dutch,This is a manually annotated subset of the much larger (approx.. 500 million) word) SoNaR corpus.#SEPThe corpus is available for download from the Dutch Language Institute.,Download,http://ivdnt.org/downloads/taalmaterialen/tstc-sonar-corpus,,,
The ACL RD-TEX 2.0,http://hdl.handle.net/11372/LRT-1661,33216 tokens,terminology extraction/classification,CC BY-NC-SA 4.0,English,This corpus contains 6818 terms extracted from abstracts of computational linguistics papers.#SEPThe corpus is available for download from LINDAT and through KonText.,KonText#SEPDownload,https://lindat.mff.cuni.cz/services/kontext/first_form?corpname=aclrd20_en_a#SEPhttp://hdl.handle.net/11372/LRT-1661,QasemiZadeh and Schumann (2016),https://www.clarin.eu/resource-families/manually-annotated-corpora#QasemiZadeh%20and%20Schumann%202016,
"Speech, Thought and Writing Presentation Corpus",http://ota.ox.ac.uk/desc/2540,"260,000 words",identification of reported speech,CC BY-NC-SA 3.0,English,"This corpus contains literary, newspaper and biography texts.#SEPThe corpus is available for download from the Oxford Text Archive.",Download,http://ota.ox.ac.uk/desc/2540,,,
TimeML annotated corpus of Estonian newspaper articles,http://doi.org/10.15155/1-00-0000-0000-0000-0015CL,"22,000 words",temporal semantic annotations,CC-BY-SA,Estonian,This corpus contains newspaper articles.#SEPThe corpus is available for download from META-SHARE (CELR distribution).,Download,http://doi.org/10.15155/1-00-0000-0000-0000-0015CL,,,
Estonian Treebank annotated with coreference relations,http://doi.org/10.15155/1-00-0000-0000-0000-0016AL,"107,000 words",anaphora relations,GPL,Estonian,This corpus contains newspaper texts plus one scientific medical text.#SEPThe corpus is available for download from META-SHARE (CELR distribution).,Download,http://doi.org/10.15155/1-00-0000-0000-0000-0016AL,,,
Semantically disambiguated corpus of Estonian,http://doi.org/10.15155/1-00-0000-0000-0000-00081L,"375,733 tokens",word sense disambiguation,CLARIN ACA,Estonian,The corpus is available for download from META-SHARE (CELR distribution).,Download,http://doi.org/10.15155/1-00-0000-0000-0000-00081L,,,
Greek Coreference Corpus,http://hdl.grnet.gr/11500/ATHENA-0000-0000-25DC-F,"62,988 tokens",coreference,CC-BY-NC-SA,Greek,"In addition to coreference, the corpus is annotated for identity and bridging relations.#SEPIn addition to coreference, the corpus is annotated for identity and bridging relations.",Download,http://hdl.grnet.gr/11500/ATHENA-0000-0000-25DC-F,,,
Greek Textual Entailment Corpus,http://hdl.grnet.gr/11500/ATHENA-0000-0000-23DB-2,600 sentence-pairs,logical entailment,CC-BY,Greek,"This corpus contains texts from the domains of politics, law and travel.#SEPThis corpus is available for download from the clarin:el repository.",Download,http://hdl.grnet.gr/11500/ATHENA-0000-0000-23DB-2,,,
KPWr (Polish Corpus of Wrocław University of Technology) 1.2,http://hdl.handle.net/11321/270,"447,000 tokens","selected predicate-argument relations, relations between named entities, anaphora relations, word senses, events, temporal expressions, spatial relations between entities, keywords and semantic roles within nominal and adjective phrases",CC BY-SA 3.0,Polish,"This corpus contains texts in a variety of domains (blogs, science, stenographic recordings, etc.).#SEPThe corpus is available for download from the CLARIN-PL repository.",Download,http://hdl.handle.net/11321/270,,,
Polish Summaries Corpus,http://zil.ipipan.waw.pl/PolishSummariesCorpus,10845 summaries,summarization,CC BY 3,Polish,This corpus is available for download from the ZIL IPI PAN repository.,Download,http://zil.ipipan.waw.pl/PolishSummariesCorpus,Ogrodniczuk and Kopeć (2014),https://www.clarin.eu/resource-families/manually-annotated-corpora#Ogrodniczuk%20and%20Mateusz%20Kope%C4%87%202014,
WUT Relations Between Sentences Corpus,http://hdl.handle.net/11321/305,5654 sentences,relations between sentences - Cross-document Structure Theory (CST),CC BY-SA 3.0,Polish,This corpus contains news items.#SEPThe corpus is available for download from the CLARIN.PL repository.,Download,http://hdl.handle.net/11321/305,,,
Serbian Twitter training corpus ReLDI-NormTagNER-sr 2.0,http://hdl.handle.net/11356/1171,"92,000 tokens",word normalisation,CC BY 4.0,Serbian,"This corpus contains Tweets. The corpus is morphosyntactically tagged following the <a href=""http://nl.ijs.si/ME/V4/msd/html/index.html"">MULTEXT-East Version 4 tagset</a>.#SEPThe corpus is available through the concordancers KonText and noSketchEngine and for download from the CLARIN.SI repository.",KonText#SEPnoSketch#SEPDownload,https://www.clarin.si/kontext/first_form?corpname=reldi_sr#SEPhttps://www.clarin.si/noske/run.cgi/corp_info?corpname=reldi_sr&struct_attr_stats=1#SEPhttp://hdl.handle.net/11356/1171,Miličević and Ljubešić (2016),https://www.clarin.eu/resource-families/manually-annotated-corpora#milicevic,
CMC training corpus Janes-Tag 2.0,http://hdl.handle.net/11356/1123,"75,000 tokens",word normalisation,CC BY-SA 4.0,Slovenian,"This corpus contains computer-mediated communication (CMC). The corpus is morphosyntactically tagged following the <a href=""http://nl.ijs.si/ME/V5/msd/"">MULTEXT-East Version 5 tagset</a>.#SEPThe corpus is available through the concordancers KonText and noSketchEngine and for download from the CLARIN.SI repository.",KonText#SEPnoSketch#SEPDownload,https://www.clarin.si/kontext/first_form?corpname=janes_tag#SEPhttps://www.clarin.si/noske/run.cgi/corp_info?corpname=janes_tag&struct_attr_stats=1#SEPhttp://hdl.handle.net/11356/1123,Fišer et al. (2018),https://www.clarin.eu/resource-families/manually-annotated-corpora#fiser,
Corpus of comma placement Vejica 1.3,http://hdl.handle.net/11356/1185,"104,000 sentences",comma placement,CC BY-NC-SA 4.0,Slovenian,"This corpus contains texts from various Slovenian corpora (<a href=""http://nl.ijs.si/isjt06/proc/26_Stritar.pdf"">KUST</a>, <a href=""http://www.slovenscina.eu/korpusi/solar"">Šolar</a> a<a href=""http://www.slovenscina.eu/korpusi/lektor"">Lektor</a>m <a href=""http://hdl.handle.net/11356/1088"">JANES-Vejica</a>n Wikpedia.#SEPThe corpus is available for dow.nload from CLARIN.SI.",Download,http://hdl.handle.net/11356/1185,,,
Terminology identification dataset KAS-term 1.0,http://hdl.handle.net/11356/1198,"22,950 term candidates",monolingual term extraction,CC BY-SA 4.0,Slovenian,"This corpus contains term candidates from PhD theses in chemistry, computer science and political science.#SEPThe corpus is available for download from the CLARIN.SI repository.",Download,http://hdl.handle.net/11356/1198,Holozan (2018),https://www.clarin.eu/resource-families/manually-annotated-corpora#Holozan%202018,
Training corpus ssj500k 2.1,http://hdl.handle.net/11356/1181,"586,000 tokens","verbal multiword expression tagging, semantic role labelling",CC BY-NC-SA 4.0,Slovenian,This corpus contains standard Slovenian.#SEPThe corpus is available through the concordancers KonText and noSketchEngine and for download from the CLARIN.SI repository.,KonText#SEPnoSketch#SEPDownload,https://www.clarin.si/kontext/first_form?corpname=ssj500k21#SEPhttps://www.clarin.si/noske/run.cgi/corp_info?corpname=ssj500k21&struct_attr_stats=1#SEPhttp://hdl.handle.net/11356/1181,,,
Bilingual terminology extraction dataset KAS-biterm 1.0,http://hdl.handle.net/11356/1199,"1,950 sentences, 78,500 tokens, 3,700 terms",bi-lingual term extraction,CC BY-SA 4.0,"Slovenian, English",This corpus contains PHD theses.#SEPThe corpus is available for download from the CLARIN.SI repository.,Download,http://hdl.handle.net/11356/1199,,,
Annotated corpora and tools of the PARSEME Shared Task on Automatic Identification of Verbal Multiword Expressions (edition 1.1),http://hdl.handle.net/11372/LRT-2842,5.8 million tokens,"identification of verbal multi-word expressions (idioms, light-verb constructions, verb-particle constructions, inherently reflexive verbs, multi-verb constructions)",PARSEME Shared Task Data (v. 1.1) Agreement,16 languages,"This corpus collection is available for download from LINDAT.#SEPThe PARSEME corpora can be queried individually through <em>KonText</em>. We provide the individual links to each corpus:#SEP<ol>    <li><a href=""https://lindat.mff.cuni.cz/services/kontext/first_form?corpname=parseme_cs_a"">Parseme VMWE 1.0 – Czech</a></li>    <li><a href=""https://lindat.mff.cuni.cz/services/kontext/first_form?corpname=parseme_de_a"">Parseme VMWE 1.0 – German</a></li>    <li><a href=""https://lindat.mff.cuni.cz/services/kontext/first_form?corpname=parseme_el_a"">Parseme VMWE 1.0 – Greek</a></li>    <li><a href=""https://lindat.mff.cuni.cz/services/kontext/first_form?corpname=parseme_es_a"">Parseme VMWE 1.0 – Spanish</a></li>    <li><a href=""https://lindat.mff.cuni.cz/services/kontext/first_form?corpname=parseme_fa_a"">Parseme VMWE 1.0 – Persian</a></li>    <li><a href=""https://lindat.mff.cuni.cz/services/kontext/first_form?corpname=parseme_fr_a"">Parseme VMWE 1.0 – French</a></li>    <li><a href=""https://lindat.mff.cuni.cz/services/kontext/first_form?corpname=parseme_hu_a"">Parseme VMWE 1.0 – Hungarian</a></li>    <li><a href=""https://lindat.mff.cuni.cz/services/kontext/first_form?corpname=parseme_it_a"">Parseme VMWE 1.0 – Italian</a></li>    <li><a href=""https://lindat.mff.cuni.cz/services/kontext/first_form?corpname=parseme_mt_a"">Parseme VMWE 1.0 – Maltese</a></li>    <li><a href=""https://lindat.mff.cuni.cz/services/kontext/first_form?corpname=parseme_pl_a"">Parseme VMWE 1.0 – Polish</a></li>    <li><a href=""https://lindat.mff.cuni.cz/services/kontext/first_form?corpname=parseme_pt_a"">Parseme VMWE 1.0 – Portuguese</a></li>    <li><a href=""https://lindat.mff.cuni.cz/services/kontext/first_form?corpname=parseme_ro_a"">Parseme VMWE 1.0 – Romanian</a></li>    <li><a href=""https://lindat.mff.cuni.cz/services/kontext/first_form?corpname=parseme_sl_a"">Parseme VMWE 1.0 – Slovenian</a></li>    <li><a href=""https://lindat.mff.cuni.cz/services/kontext/first_form?corpname=parseme_sv_a"">Parseme VMWE 1.0 – Swedish</a></li>    <li><a href=""https://lindat.mff.cuni.cz/services/kontext/first_form?corpname=parseme_tr_a"">Parseme VMWE 1.0 – Turkish</a></li>   </ol>",Download,http://hdl.handle.net/11372/LRT-2842,,,
