"Corpus";"Corpus_URL";"Language";"Size";"Annotation";"Licence";"Description";"Buttons";"Buttons_URL";"Publication";"Publication_URL";"Note"
"CzeSL – Czech as a Second Language";"http://hdl.handle.net/11234/1-162";"Czech";"0.9 million words";"tokenised, PoS-tagged, lemmatised, error labels";"CC-BY";"This corpus contains essays written in 2013 by learners from 54 L1 backgrounds.#SEPThe corpus is available for download from LINDAT.";"Download";"http://hdl.handle.net/11234/1-162";"Rosen (2016).";"https://www.clarin.eu/resource-families/L2-corpora#Rosen%202016";
"British Academic Written English Corpus";"http://hdl.handle.net/20.500.12024/2539";"English";"2761 texts";;"CC-BY";"This is primarily a L1 corpus although it also contains L2 texts.#SEPThe corpus is available for download from the University of Oxford Text Archive.";"Download";"http://hdl.handle.net/20.500.12024/2539";;;
"CORYL (Corpus of Young Learner Language)";"http://hdl.handle.net/11495/D985-A8CA-A02D-4";"English";"191,568 tokens";"tokenised, anonymised, error labels, linked to CEFR levels";"CC-BY";"This corpus contains English texts written yb Norwegian primary school pupils (7th, 10th, and 11th grade).#SEPThe corpus is available through the concordancer Corpuscle provided by CLARINO.";"Concordancer";"http://clarino.uib.no/korpuskel/landing-page?identifier=coryl&view=short";;;
"ETS Corpus of Non-Native Written English";"https://catalog.ldc.upenn.edu/LDC2014T06";"English";"12,100 essays (1100 / language)";;"restricted";"This corpus contains texts written by learners from 11 L1 backgrounds as part of an international text of academic English proficiency. Prompts as well as proficiency level are part of the metadata.#SEPThe corpus is available for download from the LDC catalogue.";"Download";"http://catalog.ldc.upenn.edu/LDC2014T06";;;
"The Hanken Corpus of Academic Writing";"http://urn.fi/urn:nbn:fi:lb-2016081504";"English";"500,000 words";;"CC-BY";"This corpus contains academic texts  written by Finnish and Swedish native speakers.#SEPThe corpus is still under development.";;;;;
"ICLE International Corpus of Learner English";"http://hdl.handle.net/11372/LRT-859";"English";"3 million words";;;"This corpus contains texts written by learners of English from 14 L1 backgrounds.#SEPThe corpus can be <a href=""https://www.i6doc.com/en/collections/cdicle/>purchased on CD-ROM</a> and a new version ""(ICLE v.3) is in development.";;;;;
"The Uppsala Student English corpus";"http://hdl.handle.net/20.500.12024/2457";"English";"1.2 million tokens";"tokenised";"CC-BY";"This corpus contains essays written during the first three semesters of English studies at Uppsala University; most of the essays were written during the first semester. The corpus contains text files, each with a student ID and text ID including the course level, and information about the different prompts are available.#SEPThe corpus is available for download from the University of Oxford Text Archive.";"Download";"http://hdl.handle.net/20.500.12024/2457";;;
"The Advanced Finnish Learners’ Corpus";"http://urn.fi/urn:nbn:fi:lb-201407167";"Finnish";"288,000 tokens";"tokenised, MSD-tagged, lemmatised";"CLARIN RES";"This corpus contains academic texts written by MA students and collected in 2009.#SEPThe corpus consists of two subcorpora - <a href=""http://urn.fi/urn:nbn:fi:lb-2016041401"">The Exam Essays Subcorpus</a> and the <a href=""http://urn.fi/urn:nbn:fi:lb-2016041402"">Course Papers Subcorpus</a>, both of which are also available through Korp.";"Concordancer#SEPDownload#SEPDownload";"https://korp.csc.fi/#?cqp=%5B%5D&corpus=las2_tentit,las2_esseet&prequery_within=sentence#SEPhttp://urn.fi/urn:nbn:fi:lb-2016041401#SEPhttp://urn.fi/urn:nbn:fi:lb-2016041402";;;
"International Corpus of Learner Finnish (ICLFI) Corpus";"http://urn.fi/urn:nbn:fi:lb-20140730163";"Finnish";"1 million words";"MSD-tagged";"CLARIN RES";"This corpus contains fictional (e.g., letters, narratives) and non-fictional (e.g., essays) texts.#SEPThe corpus provides information on a large number of variables concerning the linguistic background of the learner, the learning task, the learning context, etc. It is available through the concordancer Korp.";"Concordancer";"https://korp.csc.fi/#?cqp=[]&corpus=iclfi";"Jantunen (2011).";"https://www.clarin.eu/resource-families/L2-corpora#Jantunen%202011";
"Testipiste Corpus";"http://urn.fi/urn:nbn:fi:lb-2017020701";"Finnish";"840,000 tokens";"tokenised";"CLARIN RES";"This corpus contains essays written by adult migrants from various L1 backgrounds.#SEPThe corpus will be made available through the concordancer Korp.";;;;;
"Commented Learner Corpus Academic Writing";"http://hdl.handle.net/11022/0000-0006-CD41-A";"German";"853 texts";;"CC BY-NC-SA 3.0";"This corpus contains texts written by students at the University of Hamburg from various L1 backgrounds.#SEPThe corpus is available for download through the repository of the University of Hamburg.";"Download";"http://hdl.handle.net/11022/0000-0006-CD41-A";;;
"ASK – Norsk andrespråkskorpus";"http://hdl.handle.net/11495/DA23-DEB6-9EE5-2";"Norwegian";"618,000 tokens";"tokenised, PoS-tagged, errors";"CLARIN RES";"This corpus contains essays and tests written by students from 10 L1 backgrounds. It also contains L1 control essays.#SEPThe corpus is available through a dedicated concordancer provided by CLARINO.";"Concordancer";"http://clarino.uib.no/korpuskel/corpus-list?collection=ASK";;;
"FinSveStud 79-80";"http://urn.fi/urn:nbn:fi:lb-20140730119";"Swedish";"175,000 tokens";"tokenised, lemmatised";"CLARIN RES";"This corpus contains texts written by students with Finnish as their L1 background.#SEPThe corpus is available through the concordancer Korp.";"Concordancer";"https://korp.csc.fi/?mode=swedish#?corpus=studentsvenska";;;
"SpIn";"https://spraakbanken.github.io/swell-release-v1/Metadata-SpIn";"Swedish";"46,911 tokens; 4,302 sentences";"tokenised, PoS-tagged, MSD-tagged, lemgrams, compounds word forms";"CC-BY";"This corpus contains essays from a Language Introduction course for newly arrived students (256 essays; 166 students, some of whom are recurrent) – i.e., course preparation for Swedish upper-intermediate school (gymnasium-level).It is a subcorpus of the pilot <a href=""https://spraakbanken.gu.se/en/projects/swell/swell4users"">SweLL corpus</a>. #SEPAside from the automatic linguistic annotation, the corpus is manually annotated for CEFR labels (A1-B2). See <a href=""https://spraakbanken.github.io/swell-release-v1/Metadata-SpIn"">the metadata description</a> for further details on the automatic and manual annotation.#SEPThe corpus is available in Språkbanken Text / the SweLL infrastructure through an individual application form.";"Online (application)";"https://spraakbanken.gu.se/en/projects/swell/swell4users ";;;
"SW1203-essays";"https://spraakbanken.gu.se/eng/resource/sw1203#tabs=information";"Swedish";"52,528 tokens; 3,145 sentences";"tokenised, PoS-tagged, MSD-tagged, lemgrams, compounds word forms";"CC-BY";"This corpus contains essays from a preparatory university course with three essays written by (almost) all students: (1) entrance essay, (2) mid-term essay; (3) fnal exam essay; (4) final exam retake for some students. The corpus is longitudinal in a way. It is a subcorpus of the pilot <a href=""https://spraakbanken.gu.se/en/projects/swell/swell4users"">SweLL corpus</a>. #SEPAside from the automatic linguistic annotation, the corpus is manually annotated for CEFR labels (B1-C2). See <a href=""https://spraakbanken.github.io/swell-release-v1/Metadata-SW1203"">the metadata description</a> for further details on the automatic and manual annotation.#SEPThe corpus is available for download from Språkbanken, through the concordancer Korp, and in Språkbanken Text / the SweLL infrastructure through an individual application form.";"Concordancer (Korp)#SEPOnline (application)#SEPDownload";"http://spraakbanken.gu.se/korp/#corpus=sw1203#SEPhttps://sunet.artologik.net/gu/swell#SEPhttp://spraakbanken.gu.se/eng/resource/sw1203#tabs=information";;;
"SweLL-gold";"https://spraakbanken.github.io/swell-release-v1/Metadata-SweLL";"Swedish";"147,842 tokens (original version), 151,851 (normalized version); 7,807 sentences (original), 8,137 sentences (normalized)";"tokenised, PoS-tagged, MSD-tagged, lemgrams, compounds word forms";"CC-BY";"This corpus contains essays from various education establishments in Sweden for non-Swedish speaking adult learners.#SEPAside from the automatic linguistic annotation, the corpus is manually annotated at the following levels: pseudonymization, normalization, and correction annotation. See <a href=""https://spraakbanken.github.io/swell-release-v1/Metadata-SweLL"">the metadata description</a> for further details on the automatic and manual annotation.#SEPThe corpus is in Språkbanken Text / the SweLL infrastructure through an individual application form.";"Online (application)";"https://spraakbanken.gu.se/en/projects/swell/swell4users ";;;
"Tisus corpus";"https://spraakbanken.gu.se/eng/resource/tisus";"Swedish";"60,632 tokens; 3,422 sentences";"tokenised, PoS-tagged, MSD-tagged, lemgrams, compounds word forms";"CC-BY";"This corpus contains essays from a test situationwritten by adult learners (105 essays, 105 sutdents; one essay per student). The essays are argumentative on the topic of stress, written at an advanced level. This is a subcorpus of the pilot <a href=""https://spraakbanken.gu.se/en/projects/swell/swell4users"">SweLL corpus</a>.#SEPAside from the automatic linguistic annotation, the corpus is manually annotated for CEFR labels (B2-C1). See <a href=""https://spraakbanken.github.io/swell-release-v1/Metadata-TISUS"">the metadata description</a> for further details on the automatic and manual annotation.#SEPThe corpus is available for download from Språkbanken, through the concordancer Korp, and in Språkbanken Text / the SweLL infrastructure through an individual application form.";"Concordancer (Korp)#SEPOnline (application)#SEPDownload";"http://spraakbanken.gu.se/korp/#corpus=tisus#SEPhttps://sunet.artologik.net/gu/swell#SEPhttp://spraakbanken.gu.se/eng/resource/tisus";;;
